{
  "type": "client.hello", "protocolVersion": 2,
  "clientId": "tab-s9-01",
  "device": { "manufacturer": "samsung", "model": "SM-X710", "osVersion": "16" },
  "mode": "live",
  "camera": {
    "imageWidth": 960, "imageHeight": 540,
    "focalPx": 745.2, "principalPoint": [480.0, 270.0],
    "mountHeightMeters": 1.25, "pitchDegrees": null,
    "lensFacing": "back", "stabilization": false
  },
  "sim": null
}
